title,url,source,ingredient,sentiment,sentiment_score,date,snippet,category
Lutemax 2020 Shows Promise in Eye Health Study,https://www.nutraingredients.com/lutemax-study,NutraIngredients,Lutemax 2020,positive,4.5,2024-01-15,Clinical study demonstrates significant benefits of Lutemax 2020 in supporting eye health and visual performance.,Industry News
CurcuWIN Bioavailability Breakthrough,https://www.nutritionaloutlook.com/curcuwin-bioavailability,Nutritional Outlook,CurcuWIN,positive,4.5,2024-02-20,New research confirms CurcuWIN's superior bioavailability compared to standard curcumin extracts.,Industry News
Capsimax Market Competition Intensifies,https://www.naturalproductsinsider.com/capsimax-competition,Natural Products Insider,Capsimax,neutral,3.0,2024-03-10,"Market analysis shows increased competition in the thermogenic ingredients space, with several new players entering the market alongside established brands like Capsimax.",Industry News
BioPerine Patent Questions Raised,https://www.supplementbusiness.com/bioperine-patent,Supplement Business,BioPerine,neutral,3.0,2024-01-30,Industry experts discuss patent landscape and competitive challenges facing established bioenhancer ingredients in the current market.,Industry News
Oligopin Supply Chain Challenges,https://www.nutraingredients.com/oligopin-supply,NutraIngredients,Oligopin,negative,2.2,2024-02-28,"Manufacturers report supply chain disruptions affecting availability of premium pine bark extracts, leading to increased costs and delivery delays.",Industry News
ForsLean Clinical Data Under Review,https://www.nutritionaloutlook.com/forslean-review,Nutritional Outlook,ForsLean,neutral,3.0,2024-03-05,Regulatory bodies continue evaluation of weight management claims for coleus forskohlii extracts as industry awaits updated guidelines.,Industry News
Sabeet Pricing Concerns in Sports Nutrition,https://www.sportsnutritioninsider.com/sabeet-pricing,Sports Nutrition Insider,Sabeet,negative,2.2,2024-02-15,Sports nutrition manufacturers express concerns over premium pricing of branded beetroot extracts impacting product margins and market accessibility.,Industry News
Lutein Market Consolidation Trends,https://www.nutraingredients.com/lutein-consolidation,NutraIngredients,Lutemax 2020,neutral,3.0,2024-03-20,Market analysis reveals ongoing consolidation in the lutein and zeaxanthin space as larger players acquire smaller ingredient suppliers.,Industry News
